{
  "schema_version": "1.0.0",
  "record_type": "intervention",
  "id": "dietary-protein-restriction",
  "name": "Dietary Protein Restriction",
  "summary": "Lifestyle lever that can reduce GHR/IGF-1 activity, with epidemiologic and animal-tumor evidence suggesting strong age-dependent tradeoffs.",
  "aliases": [
    "low-protein diet",
    "protein restriction"
  ],
  "modalities": [
    "lifestyle"
  ],
  "target_hallmark_ids": [
    "deregulated_nutrient_sensing"
  ],
  "secondary_hallmark_ids": [
    "chronic_inflammation"
  ],
  "track_ids": [
    "insulin-igf-axis-modulation",
    "caloric-restriction-mimetics"
  ],
  "mechanism_summary": "Reduces dietary amino-acid input into GH/IGF-1 and nutrient-sensing biology, but older adults may need higher protein to preserve muscle and resilience.",
  "development_stage": "clinical",
  "linked_study_ids": [
    "protein-intake-igf1-mortality-nhanes-mouse"
  ],
  "linked_finding_ids": [
    "low-protein-intake-igf1-mortality-age-boundary"
  ],
  "risk_flags": [
    "observational-human-evidence",
    "age-dependent-risk",
    "muscle-and-frailty-tradeoff",
    "diet-adherence"
  ],
  "evidence_snapshot": {
    "best_evidence_tier": "human_biomarker",
    "human_data": true,
    "open_questions": [
      "Whether protein restriction can be made safe for older adults without worsening sarcopenia or frailty",
      "Whether IGF-1 lowering is causal for the human mortality association",
      "Which protein sources and life stages matter most"
    ]
  },
  "tags": [
    "insulin-igf-axis-modulation",
    "protein-restriction",
    "igf-1",
    "diet"
  ]
}
