{
  "schema_version": "1.0.0",
  "record_type": "intervention",
  "id": "vitamin-d",
  "name": "Vitamin D",
  "summary": "Vitamin D is normalized as a DO-HEALTH combination component in DNA-methylation clock analyses.",
  "modalities": [
    "dietary_supplement"
  ],
  "target_hallmark_ids": [
    "epigenetic_alterations"
  ],
  "track_ids": [
    "dna-methylation-and-epigenome-restoration"
  ],
  "mechanism_summary": "Represents vitamin D supplementation tested alongside omega-3 and exercise in older adults, with linked evidence bounded to epigenetic-clock biomarkers.",
  "development_stage": "approved_for_other_indication",
  "linked_study_ids": [
    "do-health-omega3-vitd-exercise-dnam-clocks"
  ],
  "linked_finding_ids": [
    "do-health-omega3-small-dnam-clock-slowing"
  ],
  "risk_flags": [
    "combination-context",
    "biomarker-only",
    "small-effect-size"
  ],
  "evidence_snapshot": {
    "best_evidence_tier": "human_biomarker",
    "human_data": true,
    "open_questions": [
      "Whether the linked evidence generalizes beyond the specific population, model, tissue, or disease context already recorded in the public finding. Linked context: DO-HEALTH omega-3 showed small DNA-methylation clock slowing; DO-HEALTH omega-3 vitamin D exercise DNA-methylation clock analysis.",
      "Whether mechanism-specific effects can be separated from combination, product, delivery, or study-design confounding.",
      "Whether future studies can connect the observed biomarker, functional, or model-organism signal to durable aging-relevant outcomes."
    ]
  },
  "tags": [
    "dietary_supplement",
    "dna-methylation-and-epigenome-restoration",
    "epigenetic_alterations",
    "vitamin-d"
  ],
  "created_at": "2026-06-07T20:00:00Z",
  "updated_at": "2026-06-07T20:00:00Z"
}
