{
  "schema_version": "1.0.0",
  "record_type": "intervention",
  "id": "arimoclomol",
  "name": "Arimoclomol",
  "summary": "Small-molecule heat-shock response co-inducer with rare-disease human evidence and regulatory context, tracked as a disease-specific chaperone-support signal.",
  "modalities": [
    "small_molecule"
  ],
  "target_hallmark_ids": [
    "loss_of_proteostasis"
  ],
  "track_ids": [
    "chaperone-and-heat-shock-support"
  ],
  "mechanism_summary": "Amplifies stress-induced heat-shock protein responses rather than broadly clearing protein aggregates.",
  "development_stage": "approved_for_other_indication",
  "linked_study_ids": [
    "arimoclomol-als-orarials-phase3",
    "arimoclomol-inclusion-body-myositis-trial",
    "arimoclomol-npc-phase-2-3"
  ],
  "linked_finding_ids": [
    "arimoclomol-als-phase3-null",
    "arimoclomol-ibm-trial-null",
    "arimoclomol-npc-r4dnpccss-posthoc-support",
    "arimoclomol-slowed-npc-disease-progression",
    "miplyffa-approved-npc-neurological-symptoms"
  ],
  "risk_flags": [
    "rare-disease-specific",
    "mixed-disease-results",
    "hypersensitivity"
  ],
  "evidence_snapshot": {
    "best_evidence_tier": "human_function",
    "human_data": true,
    "open_questions": [
      "Whether disease-specific chaperone support generalizes to aging-relevant proteostasis",
      "Why NPC signals do not translate cleanly across other protein-misfolding diseases"
    ]
  },
  "tags": [
    "chaperone-and-heat-shock-support",
    "small-molecule",
    "heat-shock-response",
    "npc"
  ]
}
