{
  "schema_version": "1.0.0",
  "record_type": "intervention",
  "id": "hypothalamic-nfkb-inhibition",
  "name": "Hypothalamic NF-kappaB inhibition",
  "summary": "Hypothalamic NF-kappaB inhibition is normalized for mouse neuroendocrine and inflammatory aging evidence.",
  "modalities": [
    "other"
  ],
  "target_hallmark_ids": [
    "altered_intercellular_communication",
    "chronic_inflammation"
  ],
  "track_ids": [
    "neuroendocrine-and-systemic-signal-reset"
  ],
  "mechanism_summary": "Suppresses NF-kappaB signaling in the hypothalamus to test whether central inflammatory control changes systemic aging phenotypes.",
  "development_stage": "preclinical",
  "linked_study_ids": [
    "hypothalamic-nfkb-gnrh-aging-mice"
  ],
  "linked_finding_ids": [
    "hypothalamic-nfkb-inhibition-gnrh-decelerated-mouse-aging"
  ],
  "risk_flags": [
    "animal-only",
    "central-nervous-system-delivery",
    "target-wide-effects"
  ],
  "evidence_snapshot": {
    "best_evidence_tier": "animal",
    "human_data": false,
    "open_questions": [
      "Whether the linked evidence generalizes beyond the specific population, model, tissue, or disease context already recorded in the public finding. Linked context: Hypothalamic NF-kappaB and GnRH mouse aging study; Hypothalamic NF-kappaB inhibition and GnRH slowed mouse aging phenotypes.",
      "Whether mechanism-specific effects can be separated from combination, product, delivery, or study-design confounding.",
      "Whether future studies can connect the observed biomarker, functional, or model-organism signal to durable aging-relevant outcomes."
    ]
  },
  "tags": [
    "altered_intercellular_communication",
    "chronic_inflammation",
    "hypothalamic-nfkb-inhibition",
    "neuroendocrine-and-systemic-signal-reset",
    "other"
  ],
  "created_at": "2026-06-07T20:00:00Z",
  "updated_at": "2026-06-07T20:00:00Z"
}
