{
  "schema_version": "1.0.0",
  "record_type": "intervention",
  "id": "microbial-indoles",
  "name": "Microbial indoles",
  "summary": "Family of tryptophan-derived microbial metabolites, including indole and related AhR-linked signals, tested mainly in model-system healthspan experiments.",
  "aliases": [
    "commensal bacterial indoles",
    "microbiota-derived indoles"
  ],
  "modalities": [
    "small_molecule",
    "dietary_supplement"
  ],
  "target_hallmark_ids": [
    "dysbiosis"
  ],
  "secondary_hallmark_ids": [
    "altered_intercellular_communication",
    "chronic_inflammation"
  ],
  "track_ids": [
    "microbiome-metabolite-restoration",
    "live-biotherapeutics-and-engineered-microbes"
  ],
  "mechanism_summary": "Signals from commensal tryptophan metabolism can engage host stress-response, barrier, inflammatory, and AhR-linked biology, but therapeutic translation remains mostly model-system or indirect diet/probiotic target engagement.",
  "development_stage": "preclinical",
  "linked_study_ids": [
    "microbial-indoles-healthspan-models"
  ],
  "linked_finding_ids": [
    "commensal-indoles-extended-healthspan-models"
  ],
  "risk_flags": [
    "heterogeneous-metabolite-family",
    "mostly-model-system-evidence",
    "therapeutic-formulation-unclear"
  ],
  "evidence_snapshot": {
    "best_evidence_tier": "animal",
    "human_data": false,
    "open_questions": [
      "Which specific indole metabolites are safe and beneficial under chronic dosing",
      "Whether model-system healthspan effects translate to mammalian aging or human outcomes",
      "How to separate direct metabolite replacement from live-microbe production strategies"
    ]
  },
  "tags": [
    "microbiome-metabolite-restoration",
    "microbial-indoles",
    "tryptophan-metabolism",
    "ahr"
  ]
}
