{
  "schema_version": "1.0.0",
  "record_type": "intervention",
  "id": "xenogeneic-mitochondrial-transplantation",
  "name": "Xenogeneic Mitochondrial Transplantation",
  "summary": "Preclinical transplantation of mitochondria across species boundaries, tracked separately because donor equivalence, immune compatibility, and quality control are central limitations.",
  "aliases": [
    "xeno-MT",
    "xenogeneic mitochondria transplantation",
    "cross-species mitochondrial transplantation"
  ],
  "modalities": [
    "procedure",
    "cell_therapy"
  ],
  "target_hallmark_ids": [
    "mitochondrial_dysfunction"
  ],
  "track_ids": [
    "mitochondrial-delivery-and-transplantation"
  ],
  "mechanism_summary": "The approach supplies donor mitochondria from a different species with the goal of improving host mitochondrial function and age-associated phenotypes, while exposing source-compatibility, respiratory-competence, immunogenicity, and durability questions.",
  "development_stage": "preclinical",
  "linked_study_ids": [
    "xeno-mt-age-associated-phenotypes-mice"
  ],
  "linked_finding_ids": [
    "xeno-mt-improved-age-associated-phenotypes-mice"
  ],
  "risk_flags": [
    "xenogeneic-source-compatibility-uncertain",
    "immunogenicity-and-mtdna-compatibility-uncertain",
    "long-term-safety-unknown",
    "donor-mitochondrial-quality-sensitive",
    "animal-only-aging-evidence"
  ],
  "evidence_snapshot": {
    "best_evidence_tier": "animal",
    "human_data": false,
    "open_questions": [
      "Whether benefits replicate with other donor species or donor preparations",
      "Whether mitochondrial respiratory competence predicts in vivo efficacy across tissues",
      "Whether cross-species donor mitochondria raise unacceptable immune, germline, or long-term safety risks",
      "Whether age-associated phenotype movement is durable and functionally meaningful beyond short animal windows"
    ]
  },
  "tags": [
    "mitochondrial-delivery-and-transplantation",
    "xenogeneic",
    "animal-aging",
    "preclinical"
  ]
}
