{
  "schema_version": "1.0.0",
  "record_type": "intervention",
  "id": "ta-65",
  "name": "TA-65",
  "summary": "Astragalus-derived telomerase activator product with human telomere-length and immune-biomarker studies plus preclinical short-telomere mouse evidence.",
  "modalities": [
    "dietary_supplement",
    "small_molecule"
  ],
  "target_hallmark_ids": [
    "telomere_attrition"
  ],
  "track_ids": [
    "telomerase-restoration"
  ],
  "mechanism_summary": "Reported telomerase-activating product intended to affect telomere biology, most directly represented by leukocyte telomere-length and immune-biomarker endpoints.",
  "development_stage": "clinical",
  "linked_study_ids": [
    "ta65-adult-old-mice-healthspan",
    "ta65-health-maintenance-human-cohort",
    "ta65-human-telomere-length-rct",
    "ta65-post-mi-immunosenescence-rct"
  ],
  "linked_finding_ids": [
    "ta65-health-maintenance-short-telomere-immune-signal",
    "ta65-low-dose-increased-human-telomere-length",
    "ta65-mouse-short-telomere-healthspan-signal",
    "ta65-post-mi-immune-biomarkers-mixed"
  ],
  "risk_flags": [
    "commercial-conflicts",
    "biomarker-not-function",
    "dose-response-unclear"
  ],
  "evidence_snapshot": {
    "best_evidence_tier": "human_biomarker",
    "human_data": true,
    "open_questions": [
      "Whether telomere-length changes translate into functional or disease benefit",
      "Whether effects replicate independently with clear dose response and safety boundaries"
    ]
  },
  "tags": [
    "telomerase-restoration",
    "ta-65",
    "telomere-length",
    "human-biomarker"
  ]
}
