{
  "schema_version": "1.0.0",
  "record_type": "intervention",
  "id": "hypothalamic-stem-cell-exosomes",
  "name": "Hypothalamic stem-cell exosomes",
  "summary": "Hypothalamic stem-cell exosomes are normalized for mouse aging studies of hypothalamic secretome signaling.",
  "modalities": [
    "biologic"
  ],
  "target_hallmark_ids": [
    "altered_intercellular_communication",
    "stem_cell_exhaustion"
  ],
  "track_ids": [
    "neuroendocrine-and-systemic-signal-reset"
  ],
  "mechanism_summary": "Uses extracellular vesicles from hypothalamic stem cells to test whether secreted factors mediate neuroendocrine effects on aging phenotypes.",
  "development_stage": "preclinical",
  "linked_study_ids": [
    "hypothalamic-stem-cell-exosome-aging-mice"
  ],
  "linked_finding_ids": [
    "hypothalamic-stem-cell-exosomes-slowed-mouse-aging"
  ],
  "risk_flags": [
    "animal-only",
    "central-signaling-boundary",
    "product-composition-uncertainty"
  ],
  "evidence_snapshot": {
    "best_evidence_tier": "animal",
    "human_data": false,
    "open_questions": [
      "Whether the linked evidence generalizes beyond the specific population, model, tissue, or disease context already recorded in the public finding. Linked context: Hypothalamic stem-cell exosome mouse aging study; Hypothalamic stem-cell exosomes slowed mouse aging phenotypes.",
      "Whether mechanism-specific effects can be separated from combination, product, delivery, or study-design confounding.",
      "Whether future studies can connect the observed biomarker, functional, or model-organism signal to durable aging-relevant outcomes."
    ]
  },
  "tags": [
    "altered_intercellular_communication",
    "biologic",
    "hypothalamic-stem-cell-exosomes",
    "neuroendocrine-and-systemic-signal-reset",
    "stem_cell_exhaustion"
  ],
  "created_at": "2026-06-07T20:00:00Z",
  "updated_at": "2026-06-07T20:00:00Z"
}
